{
  "version": 1,
  "slug": "tiedao-dangan",
  "source": "llm",
  "judged_at": "2026-06-22 10:47 UTC",
  "golden_chapters": [
    1,
    5,
    10
  ],
  "chapters": [
    {
      "chapter": 1,
      "ratings": [
        {
          "dimension": "imagery",
          "score": 5,
          "evidence": "月光被云切成薄片、落在路肩上像一层霜；道砟颗粒嵌入纸边、压痕密度往中间递减——视觉与触觉细节均达到样章级",
          "action": "keep"
        },
        {
          "dimension": "hook",
          "score": 5,
          "evidence": "开篇风带松针铁锈味、签字栏单一代号、负责人永远'待定'、频道5的呼吸与敲击、涵洞口褪色日期——每300米即埋一个新钩子，密度极高",
          "action": "keep"
        },
        {
          "dimension": "agency",
          "score": 5,
          "evidence": "纪川主动关灯、揭告示、翻笔记本、关闭手台后又独自往涵洞方向数枕木，每一步皆由其意志驱动，无被动等待",
          "action": "keep"
        },
        {
          "dimension": "vitality",
          "score": 2,
          "evidence": "系统检测P1:单一句式占比54%超40%；正文大量'X是Y''他V了O'的短陈述句连缀，长短句交替不足，需重写句式节奏",
          "action": "rewrite"
        },
        {
          "dimension": "dialogue",
          "score": 5,
          "evidence": "'梦见岔尖响了''别往涵洞那边去''回……'——台词极度克制，每句都承载信息与人物关系，符合铁路值班室语境的低音量真实感",
          "action": "keep"
        },
        {
          "dimension": "genre",
          "score": 4,
          "evidence": "铁路悬疑类型要素齐备：弃线道口、天窗、失踪实习生、第三个部门、铁丝网封死涵洞、频道异常；仅'负责人待定'与失踪案的因果闭环尚未在本章闭合",
          "action": "keep"
        }
      ]
    },
    {
      "chapter": 5,
      "ratings": [
        {
          "dimension": "imagery",
          "score": 5,
          "evidence": "头灯红光明灭、舌根黏上颚、水袋接缝挤开、凿痕排列整齐等触觉视觉细节密集且精准，竖井逼仄空间感极强。",
          "action": "keep"
        },
        {
          "dimension": "hook",
          "score": 5,
          "evidence": "开篇渴醒悬念、方晓那句「上一个查的人已经出了事」直接抛出核心谜团，章末循环录音再现形成闭合钩子，密度极高。",
          "action": "keep"
        },
        {
          "dimension": "agency",
          "score": 4,
          "evidence": "纪川多次主动决策——摸水袋、关自动锤、掐断录音、计划带数据卡出去，主导求生与探秘，但部分段落以内心回忆为主，外在行动略缓。",
          "action": "keep"
        },
        {
          "dimension": "vitality",
          "score": 3,
          "evidence": "短句叙述流畅有力，但连续使用破折号连接的单句/并列短句结构重复率高，「——」分段密集，长短句交替不足。",
          "action": "trim"
        },
        {
          "dimension": "dialogue",
          "score": 5,
          "evidence": "工棚对话极简克制，「你不需要理由」「我让你走是因为你再往下查会出事」符合人物身份，冷淡语气中暗含张力，符合悬疑矿道类型语感。",
          "action": "keep"
        },
        {
          "dimension": "genre",
          "score": 4,
          "evidence": "矿道求生+悬疑揭秘+旧线怪谈类型元素齐备，竖井环境、专业术语（K47+247、轨旁位移）、循环录音都到位，但「超自然」线索仅靠暗示稍弱。",
          "action": "keep"
        }
      ]
    },
    {
      "chapter": 10,
      "ratings": [
        {
          "dimension": "imagery",
          "score": 5,
          "evidence": "搪瓷缸的凉水、藤椅、避车台白道砟、+250测绘图折痕硌肋骨，物件与体感细节高度具体，镜头感强。",
          "action": "keep"
        },
        {
          "dimension": "hook",
          "score": 4,
          "evidence": "开篇'天窗解除第七天'即定悬念，'旧里程找竖井'、'频道5终于安静了'两处情绪钩分布均匀。",
          "action": "keep"
        },
        {
          "dimension": "agency",
          "score": 3,
          "evidence": "纪川主动交付录音与工牌、关闭频道5，但全程以接受/送别为主，主动改变局面的决策缺位。",
          "action": "trim"
        },
        {
          "dimension": "vitality",
          "score": 2,
          "evidence": "短句占比过高且句式雷同，P1检测单一句式56%，虽契合冷峻基调却显单调。",
          "action": "rewrite"
        },
        {
          "dimension": "dialogue",
          "score": 5,
          "evidence": "'疼吗？'与'他在井里把里程留下来了'一问一答克制有力，'不进/记录送到了'收束干净。",
          "action": "keep"
        },
        {
          "dimension": "genre",
          "score": 4,
          "evidence": "工业悬疑+情感余韵完成度高，禁入公告、里程、频道5等职业元素到位，结尾'什么都没发生过'点题。",
          "action": "keep"
        }
      ]
    }
  ]
}
